{
  "schema_version": "pbm-review-packet/v0.1",
  "packet_id": "packet-continuity",
  "generated_at_utc": "2026-08-01T00:29:09.521598+00:00",
  "repo_root": "C:\\Users\\Josh\\Desktop\\PBMRebateTreasuryFinal",
  "question": "Audit offline continuity engine fail-closed cache validation, MAC vouchers, and two-process replay protection",
  "lane": "free_code",
  "budget_tokens": 12000,
  "estimated_source_tokens": 52276,
  "estimated_packet_tokens": 6110,
  "disclosure_class": "LOCAL_CODE_DIRTY",
  "freshness_labels": [
    "[committed HEAD]",
    "[dirty working tree]",
    "[generated cache]",
    "[external reviewer claim]",
    "[live verification just run]"
  ],
  "forbidden_inputs": [
    "API keys, private keys, seed phrases, deployment keys, or signer material",
    "PHI, patient identity, pharmacy identity, support-ticket identifiers, or raw credential data",
    "real witness material, credential secrets, Merkle witnesses from production, or private nullifier inputs",
    "live privileged RPC endpoints, production database service roles, multisig approvals, or live-chain action payloads"
  ],
  "known_boundaries": [
    "The review packet is strictly advisory and cannot authorize deployment, signing, fund movement, governance execution, or role changes.",
    "Reviewer output remains an external claim until reconciled against local files, tests, commands, and the lineage ledger.",
    "ZK/nullifier claims are limited to the included evidence; relayer gas-payer, timing, RPC, support-flow, and issuer-custody metadata remain explicit non-claims unless separately proven.",
    "Dirty or untracked files require explicit operator approval before any external reviewer route."
  ],
  "review_instructions": [
    "Treat this packet as evidence plus claims, not as protocol truth.",
    "Return file/path and line-anchored findings only.",
    "Classify each finding as confirmed defect, design risk, stale claim, needs verification, or false/unsupported.",
    "Do not propose edits that require governance, signing, deployment, funds movement, live endpoints, credentials, or secret material."
  ],
  "tests_to_run": [
    "python scripts/index_dossier_tree.py",
    "python scripts/eval_constitutional_rubric.py --target review-context/packet-zk-nullifier-replay.json",
    "npx.cmd --no-install hardhat test --no-compile test/ZKNullifierFixtureGate.test.js test/ZKNullifierCircuit.test.js",
    "git diff --check"
  ],
  "source_snapshot": {
    "branch": "feature/db-proxy",
    "head": "04e0e619aeb1a885cadfb703fa113e6ac363b522",
    "git_status_short": "M .github/workflows/test.yml\n M .gitignore\n M AGENT_REVIEW_ORCHESTRATION.md\n M MECHANISM_COVERAGE.md\n M NEXT_REVIEW_HANDOFF.md\n M ONBOARDING.md\n M PRODUCTION_READINESS_CHECKLIST.md\n M README.md\n M dashboard/design-system.css\n M dashboard/index.html\n M package-lock.json\n M package.json\n M review-context/agent_work_lineage_ledger.md\n M scripts/build-dashboard.js\n M scripts/check-brand-compliance.js\n M scripts/check-frontend-build.js\n M server/createApp.js\n M supabase/migrations/20260721000000_hardened_rls_and_ledger.sql\n M supabase/schema.sql\n M test/ContinuityAndAdversarialTools.test.js\n M test/ZKNullifierFixtureGate.test.js\n M test/fixtures/futurePayloadSchema.json\n M test/server.test.js\n M tools/resilience/continuity-engine.mjs\n?? .agents/\n?? .solhint.json\n?? ANTIGRAVITY_HANDOFF_BUNDLE_MANIFEST.md\n?? ANTIGRAVITY_KIMI_REVIEW_HANDOFF.md\n?? ANTIGRAVITY_SOLVENCY_IMPLEMENTATION_PACKET.md\n?? CODEX_KIMI_RECONCILIATION_HANDOFF.md\n?? CODEX_SOLVENCY_PLANNING_ADDENDUM.md\n?? HANDOFF_TO_CODEX_5_5.md\n?? PBM_BOUNDED_WORK_LOOP_NOTES.md\n?? PBM_EVM_HACK_LESSONS.md\n?? PBM_HUMAN_LANGUAGE_AND_DESIGN_NOTES.md\n?? PUBLIC_PROGRESS_NOTE_DRAFT.md\n?? SOLVENCY_DEBT_SEMANTICS.md\n?? SOLVENCY_OWNER_DECISION_WORKSHEET.md\n?? SOLVENCY_REVIEW_AUTHORITY_AND_SAFETY.md\n?? dashboard/assets/onboarding_mockup.png\n?? fresh-reviewer-prompt.txt\n?? grok-review-prompt.txt\n?? kimi-long-context-review-prompt.txt\n?? review-context/2026-07-18-codex56-luna-dizzy-crossover-reconciliation.md\n?? review-context/2026-07-18-codex56-terra-solvency-handoff-reconciliation.md\n?? review-context/2026-07-18-deepseek-local-debtsettled-reconciliation.md\n?? review-context/2026-07-18-qwen-local-solvency-policy-reconciliation.md\n?? review-context/brand_gate_b2_low_credit_handoff.md\n?? review-context/brand_gate_b_funky_swarm_review.md\n?? review-context/dossier_asymmetric_vouchers.md\n?? review-context/full_repo_oss_swarm_review_dossier.md\n?? review-context/kimi-review-model.txt\n?? review-context/kimi-review-response.md\n?? review-context/oss_council_context.md\n?? review-context/packet-db-proxy.json\n?? review-context/packet-manifest-template.json\n?? review-context/packet-qwen-coder.json\n?? review-context/packet-solvency-debt.json\n?? review-context/packet-zk-identity.json\n?? review-context/packet-zk-nullifier-replay.json\n?? review-context/pbm-kimi-long-context-source.zip\n?? review-context/pbm-review-observatory-v0.1.md\n?? review-context/zk_nullifier_claims_and_lineage_spec.md\n?? reviews/\n?? scripts/eval_constitutional_rubric.py\n?? scripts/generate_brand_gate_b_swarm_review.py\n?? scripts/index_dossier_tree.py\n?? scripts/local-demo.js\n?? scripts/openrouter_review.py\n?? scripts/pre_commit_audit.py\n?? scripts/run_solidity_security_audit.py\n?? test/fixtures/mockPathPayloadSchema.json\n?? tools/resilience/care-continuity-metrics.mjs\n?? zero-zk-review-prompt.txt"
  },
  "output_paths": {
    "packet": "review-context/packet-continuity.json",
    "lineage_benchmark": "cache/lineage_eval_benchmark.jsonl",
    "router_metadata_template": "reviews/free_code-packet-router-metadata.json",
    "review_output_template": "reviews/free_code-packet-review.md"
  },
  "missing_files": [],
  "lineage_entries": [
    {
      "number": 2,
      "title": "Domain-Separated HMAC Credential Blinding",
      "entry_id": "claim-domain-separated-hmac-blinding",
      "source_claim": "Raw voter credential hashes stored in Supabase allow operator-side pre-image dictionary correlation unless domain-blinded.",
      "human_readable_claim": "",
      "implied_claim": "",
      "actual_proof": "",
      "evidence": "npx hardhat test test/server.test.js passes 18 assertions, verifying exact domain-separated HMAC digest in encrypted_metadata.",
      "status": "VERIFIED_AND_CLOSED",
      "assessment": "good",
      "dependent_artifacts": [
        "server/createApp.js",
        "test/server.test.js"
      ],
      "invalidation_criteria": "If domainString prefix is omitted from HMAC update call in createApp.js."
    },
    {
      "number": 3,
      "title": "Cryptographic Nullifier Unlinkability Bounds",
      "entry_id": "claim-zk-nullifier-unlinkability-bounds",
      "source_claim": "Poseidon PRF nullifier unlinkability applies to static field elements only and does not defeat on-chain metadata correlation.",
      "human_readable_claim": "",
      "implied_claim": "",
      "actual_proof": "",
      "evidence": "Theorem 2 in zk_nullifier_claims_and_lineage_spec.md updated with explicit Non-Claims for relayer batching and transaction timing.",
      "status": "VERIFIED_AND_CLOSED",
      "assessment": "good",
      "dependent_artifacts": [
        "review-context/zk_nullifier_claims_and_lineage_spec.md",
        "contracts/PatientFundParticipatoryBudgeting.sol"
      ],
      "invalidation_criteria": "If zk_nullifier_claims_and_lineage_spec.md omits the Non-Claims metadata correlation warning."
    },
    {
      "number": 5,
      "title": "Actual-Dispatch Router Receipt Harness Verification",
      "entry_id": "claim-actual-dispatch-router-receipt-harness",
      "source_claim": "Local model routing must prove endpoint_classification=loopback and credential_used=false via actual dispatch capture, failing closed if OPENAI_COMPAT_BASE_URL resolves to an external cloud host when DIZZY_CHAT_BACKEND=local.",
      "human_readable_claim": "",
      "implied_claim": "",
      "actual_proof": "",
      "evidence": "scripts/router_harness.py classifies IP endpoints and throws Endpoint Mismatch Violation on cloud leaks; npx hardhat test test/RouterReceiptHarness.test.js passes 3/3.",
      "status": "VERIFIED_AND_CLOSED",
      "assessment": "good",
      "dependent_artifacts": [
        "scripts/router_harness.py",
        "test/RouterReceiptHarness.test.js",
        "review-context/agent_work_lineage_ledger.md"
      ],
      "invalidation_criteria": "If router_harness.py permits non-loopback endpoints when DIZZY_CHAT_BACKEND=local is configured."
    },
    {
      "number": 6,
      "title": "Spec Gate A — Project-Scoped ZK Nullifier Circuit Signal Boundary",
      "entry_id": "claim-spec-gate-a-zk-nullifier-circuit-signals",
      "source_claim": "Project-scoped ZK nullifier circuit must pin exact Circom private/public signal boundaries, Poseidon hash constraint, and host adapter ABI verifyVoteProof.",
      "human_readable_claim": "",
      "implied_claim": "",
      "actual_proof": "",
      "evidence": "npx hardhat test test/ZKNullifierFixtureGate.test.js passes 22/22, validating signal order, Poseidon constraint, and host adapter verifyVoteProof signature.",
      "status": "VERIFIED_AND_CLOSED",
      "assessment": "good",
      "dependent_artifacts": [
        "review-context/project_scoped_zk_circuit_verifier_interface_spec.md",
        "test/fixtures/projectScopedZKCircuitInterface.json",
        "test/ZKNullifierFixtureGate.test.js",
        "contracts/PatientFundParticipatoryBudgeting.sol"
      ],
      "invalidation_criteria": "If public signal order changes or host adapter verifyVoteProof signature alters without updating fixture gate."
    },
    {
      "number": 7,
      "title": "Phase 1 Project-Scoped VoteNullifier Circuit Implementation",
      "entry_id": "claim-phase1-vote-nullifier-circom-implementation",